question,answer,source
"What is ROI?","Return on Investment (ROI) is a performance measure used to evaluate the efficiency of an investment. To calculate ROI, the benefit (or return) of an investment is divided by the cost of the investment. The result is expressed as a percentage or a ratio. The formula is: ROI = (Net Profit / Cost of Investment) x 100%.","Investopedia"
"How do I calculate Customer Acquisition Cost (CAC)?","Customer Acquisition Cost (CAC) is the cost associated with acquiring a new customer. To calculate it, you divide the total marketing and sales expenses over a specific period by the number of new customers acquired in that period. Formula: CAC = (Total Marketing + Sales Costs) / Number of New Customers.","HubSpot Blog"
"What are the key revenue KPIs?","Key revenue KPIs include: 1. Monthly Recurring Revenue (MRR) - Predictable revenue stream. 2. Annual Recurring Revenue (ARR) - MRR multiplied by 12. 3. Average Revenue Per User (ARPU) - Revenue generated per user. 4. Customer Lifetime Value (CLV) - Total revenue a business can expect from a single customer account. 5. Revenue Growth Rate - The speed at which the company's revenue is growing.","Salesforce Knowledge Base"
"How is Customer Lifetime Value (CLV) calculated?","Customer Lifetime Value (CLV) is calculated by multiplying the average purchase value by the average purchase frequency and then by the average customer lifespan. A simple formula is: CLV = (Average Transaction Size x Number of Transactions x Retention Period).","Shopify Guides"
"What is the difference between gross margin and net margin?","Gross margin represents the revenue left over after deducting the cost of goods sold (COGS). Formula: Gross Margin = (Revenue - COGS) / Revenue. Net margin, on the other hand, is the profit left after all expenses (including taxes and interest) have been deducted from revenue. Formula: Net Margin = (Net Income / Revenue) x 100%.","Corporate Finance Institute"
"How do you measure market share?","Market share is the percentage of a company's sales out of the total sales in its industry over a specific period. It's calculated by dividing the company's total sales or revenue by the industry's total sales over the same period. Formula: Market Share = (Your Company's Sales / Total Industry Sales) x 100%.","Gartner"
"What is a SWOT analysis?","A SWOT analysis is a strategic planning technique used to help a person or organization identify strengths, weaknesses, opportunities, and threats related to business competition or project planning. It provides a framework for reviewing strategy, position, and direction.","Wikipedia"
"How do I identify business growth drivers?","Business growth drivers are the key factors that contribute to a company's revenue and profit growth. They can be identified by analyzing: 1. Market trends and customer demand. 2. Product innovation and differentiation. 3. Operational efficiency improvements. 4. Sales and marketing effectiveness. 5. Strategic partnerships and acquisitions.","McKinsey & Company"
"What are common business risk factors?","Common business risk factors include: 1. Economic Risks (e.g., recession, inflation). 2. Financial Risks (e.g., credit risk, liquidity risk). 3. Operational Risks (e.g., supply chain disruption, technology failure). 4. Compliance Risks (e.g., regulatory changes, legal disputes). 5. Strategic Risks (e.g., new competitors, changing market dynamics).","Deloitte Risk Advisory"
"How do you define a Key Performance Indicator (KPI)?","A Key Performance Indicator (KPI) is a measurable value that demonstrates how effectively a company is achieving key business objectives. Organizations use KPIs at multiple levels to evaluate their success at reaching targets. KPIs should be SMART: Specific, Measurable, Achievable, Relevant, and Time-Bound.","Tableau"
"What is the purpose of an executive summary?","An executive summary is a brief but comprehensive synopsis of a business plan or a large report. Its purpose is to provide a high-level overview that allows readers to quickly understand the key findings and recommendations without having to read the entire document.","Harvard Business Review"
"How can I improve customer retention?","To improve customer retention, focus on: 1. Providing excellent customer service. 2. Building a customer loyalty program. 3. Personalizing the customer experience. 4. Actively seeking and acting on customer feedback. 5. Communicating regularly with customers through email or social media.","Forbes"
"What is a go-to-market (GTM) strategy?","A go-to-market (GTM) strategy is a plan that details how an organization will place its products in the market to reach maximum penetration and profitability. It outlines the target audience, marketing plan, and sales strategy.","Drift"
"What are the components of a business plan?","A standard business plan includes: 1. Executive Summary. 2. Company Description. 3. Market Analysis. 4. Organization and Management. 5. Products or Services. 6. Marketing and Sales Strategy. 7. Financial Projections.","SBA.gov"
"How do you calculate Net Promoter Score (NPS)?","Net Promoter Score (NPS) is a metric used to measure customer loyalty. It's calculated based on responses to a single question: 'How likely is it that you would recommend our company/product/service to a friend or colleague?' The score is the percentage of Promoters (score 9-10) minus the percentage of Detractors (score 0-6).","NPS.com"
"What is the cash conversion cycle?","The Cash Conversion Cycle (CCC) is a metric that expresses the length of time (in days) that it takes for a company to convert its investments in inventory and other resources into cash flows from sales. Formula: CCC = DIO + DSO - DPO (Days of Inventory Outstanding + Days Sales Outstanding - Days Payable Outstanding).","CFA Institute"
"What is a competitive advantage?","A competitive advantage is an attribute that allows an organization to outperform its competitors. This can be achieved through cost leadership, product differentiation, or by focusing on a niche market.","Michael Porter"
"How do you conduct a market analysis?","A market analysis involves assessing the size, growth, and trends of a market. Key steps include: 1. Defining the target market. 2. Researching industry trends and outlook. 3. Analyzing competitors. 4. Identifying market opportunities and challenges. 5. Summarizing findings.","CB Insights"
"What is the importance of a company's culture?","A company's culture defines the environment in which employees work. A strong culture can lead to higher employee engagement, improved productivity, and lower turnover. It attracts and retains talent, and can be a significant competitive advantage.","Gallup"
"How do you create a financial forecast?","A financial forecast projects future revenue and expenses, typically over the next 1-3 years. It involves: 1. Forecasting sales revenue based on historical data and market trends. 2. Estimating expenses, including fixed and variable costs. 3. Creating a projected income statement, balance sheet, and cash flow statement.","QuickBooks"